{
  "$schema": "urn:pfi-snt:paired-campaign:schema:1.0.0",
  "schemaVersion": "1.0.0",
  "campaignToken": "eval67-389ca16-20261021e-full",
  "plan": "full",
  "repositoryCommit": "389ca160b2a490cd66bb0194f012e2b75b3598e8",
  "startedAt": "2026-10-21T15:18:02.829Z",
  "status": "completed",
  "snapshots": {
    "fabric": {
      "id": "178e51e9ab43094d3cefa076828d032d6c55b576f35eb2a2b2d54fe9889d6fde",
      "directory": "build/benchmarks/fabric/snapshots/178e51e9ab43094d3cefa076828d032d6c55b576f35eb2a2b2d54fe9889d6fde",
      "manifestSHA256": "975f9ac77e59309d4ac6b66ddd14d1563253a58476a9cac1f3dd9d23c6eb9483"
    },
    "baseline": {
      "id": "851f3bd43c2a39b4db1ffc5458bab235bdb903ac0485600d6590d3ab66a814ce",
      "directory": "build/benchmarks/baseline/snapshots/eval67-389ca16-20261021b",
      "manifestSHA256": "40269fcd2a9526e8a6859efa776570eb691d2e4536add4d34ebf38c425313eb5"
    }
  },
  "series": {
    "fabric": "fabric/series-index.json",
    "baseline": "baseline/series-index.json"
  },
  "attempts": [
    {
      "sut": "fabric",
      "scenarioKey": "write-register-5",
      "kind": "warmup",
      "repetition": 0,
      "try": 1,
      "status": "completed",
      "startedAt": "2026-10-21T15:18:02.946Z",
      "endedAt": "2026-10-21T15:24:08.159Z",
      "directory": "fabric/write-register-5/warmup/try-1",
      "resources": "write-register-5/warmup/try-1/resources.txt",
      "summary": "write-register-5/warmup/try-1/round/summary.json"
    },
    {
      "sut": "baseline",
      "scenarioKey": "write-register-5",
      "kind": "warmup",
      "repetition": 0,
      "try": 1,
      "status": "completed",
      "startedAt": "2026-10-21T15:24:08.926Z",
      "endedAt": "2026-10-21T15:27:08.233Z",
      "directory": "baseline/write-register-5/warmup/try-1",
      "resources": "write-register-5/warmup/try-1/resources.txt",
      "summary": "write-register-5/warmup/try-1/round/summary.json"
    },
    {
      "sut": "fabric",
      "scenarioKey": "write-register-5",
      "kind": "measurement",
      "repetition": 1,
      "try": 1,
      "status": "completed",
      "startedAt": "2026-10-21T15:27:08.361Z",
      "endedAt": "2026-10-21T15:33:14.009Z",
      "directory": "fabric/write-register-5/measurements/run-01",
      "resources": "write-register-5/measurements/run-01/resources.txt",
      "summary": "write-register-5/measurements/run-01/round/summary.json"
    },
    {
      "sut": "baseline",
      "scenarioKey": "write-register-5",
      "kind": "measurement",
      "repetition": 1,
      "try": 1,
      "status": "completed",
      "startedAt": "2026-10-21T15:33:14.621Z",
      "endedAt": "2026-10-21T15:36:12.342Z",
      "directory": "baseline/write-register-5/measurements/run-01",
      "resources": "write-register-5/measurements/run-01/resources.txt",
      "summary": "write-register-5/measurements/run-01/round/summary.json"
    },
    {
      "sut": "baseline",
      "scenarioKey": "write-register-5",
      "kind": "measurement",
      "repetition": 2,
      "try": 1,
      "status": "completed",
      "startedAt": "2026-10-21T15:36:12.484Z",
      "endedAt": "2026-10-21T15:39:04.052Z",
      "directory": "baseline/write-register-5/measurements/run-02",
      "resources": "write-register-5/measurements/run-02/resources.txt",
      "summary": "write-register-5/measurements/run-02/round/summary.json"
    },
    {
      "sut": "fabric",
      "scenarioKey": "write-register-5",
      "kind": "measurement",
      "repetition": 2,
      "try": 1,
      "status": "completed",
      "startedAt": "2026-10-21T15:39:04.147Z",
      "endedAt": "2026-10-21T15:45:13.565Z",
      "directory": "fabric/write-register-5/measurements/run-02",
      "resources": "write-register-5/measurements/run-02/resources.txt",
      "summary": "write-register-5/measurements/run-02/round/summary.json"
    },
    {
      "sut": "fabric",
      "scenarioKey": "write-register-5",
      "kind": "measurement",
      "repetition": 3,
      "try": 1,
      "status": "completed",
      "startedAt": "2026-10-21T15:45:14.279Z",
      "endedAt": "2026-10-21T15:51:32.228Z",
      "directory": "fabric/write-register-5/measurements/run-03",
      "resources": "write-register-5/measurements/run-03/resources.txt",
      "summary": "write-register-5/measurements/run-03/round/summary.json"
    },
    {
      "sut": "baseline",
      "scenarioKey": "write-register-5",
      "kind": "measurement",
      "repetition": 3,
      "try": 1,
      "status": "completed",
      "startedAt": "2026-10-21T15:51:32.855Z",
      "endedAt": "2026-10-21T15:54:35.335Z",
      "directory": "baseline/write-register-5/measurements/run-03",
      "resources": "write-register-5/measurements/run-03/resources.txt",
      "summary": "write-register-5/measurements/run-03/round/summary.json"
    },
    {
      "sut": "baseline",
      "scenarioKey": "write-register-5",
      "kind": "measurement",
      "repetition": 4,
      "try": 1,
      "status": "completed",
      "startedAt": "2026-10-21T15:54:35.501Z",
      "endedAt": "2026-10-21T15:57:31.738Z",
      "directory": "baseline/write-register-5/measurements/run-04",
      "resources": "write-register-5/measurements/run-04/resources.txt",
      "summary": "write-register-5/measurements/run-04/round/summary.json"
    },
    {
      "sut": "fabric",
      "scenarioKey": "write-register-5",
      "kind": "measurement",
      "repetition": 4,
      "try": 1,
      "status": "completed",
      "startedAt": "2026-10-21T15:57:31.866Z",
      "endedAt": "2026-10-21T16:03:40.239Z",
      "directory": "fabric/write-register-5/measurements/run-04",
      "resources": "write-register-5/measurements/run-04/resources.txt",
      "summary": "write-register-5/measurements/run-04/round/summary.json"
    },
    {
      "sut": "fabric",
      "scenarioKey": "write-register-5",
      "kind": "measurement",
      "repetition": 5,
      "try": 1,
      "status": "completed",
      "startedAt": "2026-10-21T16:03:40.942Z",
      "endedAt": "2026-10-21T16:09:52.142Z",
      "directory": "fabric/write-register-5/measurements/run-05",
      "resources": "write-register-5/measurements/run-05/resources.txt",
      "summary": "write-register-5/measurements/run-05/round/summary.json"
    },
    {
      "sut": "baseline",
      "scenarioKey": "write-register-5",
      "kind": "measurement",
      "repetition": 5,
      "try": 1,
      "status": "completed",
      "startedAt": "2026-10-21T16:09:52.718Z",
      "endedAt": "2026-10-21T16:12:52.635Z",
      "directory": "baseline/write-register-5/measurements/run-05",
      "resources": "write-register-5/measurements/run-05/resources.txt",
      "summary": "write-register-5/measurements/run-05/round/summary.json"
    },
    {
      "sut": "fabric",
      "scenarioKey": "write-register-10",
      "kind": "warmup",
      "repetition": 0,
      "try": 1,
      "status": "completed",
      "startedAt": "2026-10-21T16:12:53.006Z",
      "endedAt": "2026-10-21T16:19:15.238Z",
      "directory": "fabric/write-register-10/warmup/try-1",
      "resources": "write-register-10/warmup/try-1/resources.txt",
      "summary": "write-register-10/warmup/try-1/round/summary.json"
    },
    {
      "sut": "baseline",
      "scenarioKey": "write-register-10",
      "kind": "warmup",
      "repetition": 0,
      "try": 1,
      "status": "completed",
      "startedAt": "2026-10-21T16:19:15.971Z",
      "endedAt": "2026-10-21T16:22:16.840Z",
      "directory": "baseline/write-register-10/warmup/try-1",
      "resources": "write-register-10/warmup/try-1/resources.txt",
      "summary": "write-register-10/warmup/try-1/round/summary.json"
    },
    {
      "sut": "fabric",
      "scenarioKey": "write-register-10",
      "kind": "measurement",
      "repetition": 1,
      "try": 1,
      "status": "completed",
      "startedAt": "2026-10-21T16:22:16.987Z",
      "endedAt": "2026-10-21T16:28:35.767Z",
      "directory": "fabric/write-register-10/measurements/run-01",
      "resources": "write-register-10/measurements/run-01/resources.txt",
      "summary": "write-register-10/measurements/run-01/round/summary.json"
    },
    {
      "sut": "baseline",
      "scenarioKey": "write-register-10",
      "kind": "measurement",
      "repetition": 1,
      "try": 1,
      "status": "completed",
      "startedAt": "2026-10-21T16:28:36.496Z",
      "endedAt": "2026-10-21T16:31:36.563Z",
      "directory": "baseline/write-register-10/measurements/run-01",
      "resources": "write-register-10/measurements/run-01/resources.txt",
      "summary": "write-register-10/measurements/run-01/round/summary.json"
    },
    {
      "sut": "baseline",
      "scenarioKey": "write-register-10",
      "kind": "measurement",
      "repetition": 2,
      "try": 1,
      "status": "completed",
      "startedAt": "2026-10-21T16:31:36.682Z",
      "endedAt": "2026-10-21T16:34:30.898Z",
      "directory": "baseline/write-register-10/measurements/run-02",
      "resources": "write-register-10/measurements/run-02/resources.txt",
      "summary": "write-register-10/measurements/run-02/round/summary.json"
    },
    {
      "sut": "fabric",
      "scenarioKey": "write-register-10",
      "kind": "measurement",
      "repetition": 2,
      "try": 1,
      "status": "completed",
      "startedAt": "2026-10-21T16:34:31.049Z",
      "endedAt": "2026-10-21T16:40:43.074Z",
      "directory": "fabric/write-register-10/measurements/run-02",
      "resources": "write-register-10/measurements/run-02/resources.txt",
      "summary": "write-register-10/measurements/run-02/round/summary.json"
    },
    {
      "sut": "fabric",
      "scenarioKey": "write-register-10",
      "kind": "measurement",
      "repetition": 3,
      "try": 1,
      "status": "completed",
      "startedAt": "2026-10-21T16:40:43.748Z",
      "endedAt": "2026-10-21T16:47:01.122Z",
      "directory": "fabric/write-register-10/measurements/run-03",